{"index":1,"trial_id":"increment-zero-lanes","parent_revision":"dc035d36abba86149133b02f27f822176dc2c1ca","candidate_revision":"working-tree","proposal_summary":"recognize raw all-zero increment subcubes and factor their identical Booleanity contribution","metrics":{"control_message_seconds":0.096401,"control_ingest_seconds":0.057628,"candidate_a_message_seconds":0.101087,"candidate_a_ingest_seconds":0.062641,"candidate_b_message_seconds":0.093435,"candidate_b_ingest_seconds":0.063504},"guards":{"proof_verified":true,"source_restored":true},"verdict":"discard","reason":"compute plus ingest regressed by 6.3% and 1.9% in two screens","artifacts":{"trace_a":"benchmark-runs/perfetto_traces/akita_stage6_increment_zero_22a.json","trace_b":"benchmark-runs/perfetto_traces/akita_stage6_increment_zero_22b.json"}}
{"index":2,"trial_id":"readraf-fused-condense","parent_revision":"dc035d36abba86149133b02f27f822176dc2c1ca","candidate_revision":"working-tree","proposal_summary":"update each read-RAF u_eval inside the existing RAF-Q scan instead of a separate pass","metrics":{"control_q_plus_update_seconds":0.078737,"candidate_fused_q_seconds":0.078744,"control_init_phase_seconds":0.177300,"candidate_init_phase_seconds":0.172988},"guards":{"proof_verified":true,"minimum_gain_met":false,"source_restored":true},"verdict":"discard","reason":"the fused loop moved the same work onto the Q scan and produced no direct gain","artifacts":{"trace":"benchmark-runs/perfetto_traces/akita_readraf_fused_condense_22a.json"}}
{"index":3,"trial_id":"readraf-u32-buckets","parent_revision":"dc035d36abba86149133b02f27f822176dc2c1ca","candidate_revision":"f25ca8e656502316adee7b2a7f387521d1272561","proposal_summary":"store per-table read-RAF cycle indices as u32 and widen only at vector access","metrics":{"control_2e28_grouped_index_bytes":1689155368,"candidate_2e28_grouped_index_bytes":844577684,"control_2e28_readraf_initialize_seconds":2.486735,"candidate_2e28_readraf_initialize_seconds":2.155622,"control_2e28_stage5_seconds":15.726031,"candidate_2e28_stage5_seconds":15.479330,"candidate_2e28_prove_seconds":194.001971,"candidate_2e28_maximum_rss_bytes":87524081664,"candidate_2e28_swaps":0},"guards":{"proof_verified":true,"affected_stage_not_regressed":true,"rss_limit_met":true,"zero_swaps":true,"full_validation_passed":true},"verdict":"keep","reason":"removes 805.45 MiB from the target Stage-5 live set, reduces read-RAF initialization by 13.3%, and leaves Stage 5 faster","artifacts":{"trace_2e22_a":"benchmark-runs/perfetto_traces/akita_readraf_u32_buckets_22a.json","trace_2e22_b":"benchmark-runs/perfetto_traces/akita_readraf_u32_buckets_22b.json","trace_2e26":"benchmark-runs/perfetto_traces/akita_readraf_u32_buckets_26.json","trace_2e28":"benchmark-runs/perfetto_traces/akita_28_u32_buckets.json"}}
{"index":4,"trial_id":"readraf-onepass-buckets","parent_revision":"f25ca8e656502316adee7b2a7f387521d1272561","candidate_revision":"working-tree","proposal_summary":"build worker-local per-table buckets in one scan, then merge and shrink them","metrics":{"candidate_2e22_extract_seconds":0.004614,"candidate_2e26_extract_seconds":6.644287,"parent_2e26_extract_seconds":0.242729,"candidate_2e26_stage5_seconds":11.182413},"guards":{"proof_verified":true,"large_trace_scaling_met":false,"source_restored":true},"verdict":"discard","reason":"worker-local vector growth, merging, and shrinking became super-linear at target scale","artifacts":{"trace_2e22":"benchmark-runs/perfetto_traces/akita_readraf_onepass_buckets_22a.json","trace_2e26":"benchmark-runs/perfetto_traces/akita_readraf_onepass_buckets_26.json"}}
{"index":5,"trial_id":"readraf-exact-buckets","parent_revision":"f25ca8e656502316adee7b2a7f387521d1272561","candidate_revision":"55213e9fa412effa687972b34ba49143c58eabc2","proposal_summary":"count per-table entries by worker chunk, then fill exact-capacity buckets at disjoint offsets","metrics":{"parent_2e28_extract_seconds":1.008744,"candidate_2e28_extract_seconds":0.220002,"parent_2e28_readraf_initialize_seconds":2.155622,"candidate_2e28_readraf_initialize_seconds":1.296716,"parent_2e28_stage5_seconds":15.479330,"candidate_2e28_stage5_seconds":14.487041,"candidate_2e28_prove_seconds":188.610996,"candidate_2e28_maximum_rss_bytes":87632314368,"candidate_2e28_swaps":0},"guards":{"proof_verified":true,"affected_stage_improved":true,"retained_memory_unchanged":true,"rss_limit_met":true,"zero_swaps":true,"full_validation_passed":true},"verdict":"keep","reason":"removes repeated full-table scans without allocator growth, cutting read-RAF initialization by 39.8% and Stage 5 by 6.4% at 2^28","artifacts":{"trace_2e22":"benchmark-runs/perfetto_traces/akita_readraf_exact_buckets_22.json","trace_2e26":"benchmark-runs/perfetto_traces/akita_readraf_exact_buckets_26.json","trace_2e28":"benchmark-runs/perfetto_traces/akita_28_exact_buckets.json"}}
