{"index":0,"trial_id":"baseline-2e22","parent_id":null,"candidate_revision":"2982504980883c14a68c31df93234053c8af4976","proposal_summary":"freeze an adjacent K256 screen from the accepted narrow-D128 head","started_at":"2026-07-31T01:26:00Z","finished_at":"2026-07-31T01:31:00Z","metrics":{"prove_packed_seconds":5.16,"stage6a_seconds":0.10,"stage6b_seconds":0.33,"stage7_seconds":0.04,"lattice_booleanity_message_seconds":0.10,"lattice_booleanity_ingest_seconds":0.06},"guards":{"proof_verified":true,"one_hot_k":256},"verdict":"keep","reason":"adjacent clean baseline for the diagnostic and implementation screens","artifacts":{"trace":"benchmark-runs/perfetto_traces/akita_stage6_fusion_control_22.json"}}
{"index":1,"trial_id":"trial-001-pattern-probe","parent_id":"baseline-2e22","candidate_revision":"diagnostic-working-tree","proposal_summary":"measure exact equal source tuples in the first three delayed Booleanity rounds","started_at":"2026-07-31T01:32:00Z","finished_at":"2026-07-31T01:39:00Z","metrics":{"sampled_cycles":1048576,"width2_realistic_product_reduction_fraction":0.2749,"width4_realistic_product_reduction_fraction":0.1772,"width8_realistic_product_reduction_fraction":0.1110},"guards":{"proof_verified":true,"diagnostic_removed":true},"verdict":"keep","reason":"the arithmetic ceiling cleared the screen and justified one minimal implementation attempt","artifacts":{}}
{"index":2,"trial_id":"trial-002-zero-collapse","parent_id":"baseline-2e22","candidate_revision":"working-tree","proposal_summary":"skip zero Booleanity pairs and factor repeated lane-zero terms through one shared product","started_at":"2026-07-31T01:40:00Z","finished_at":"2026-07-31T01:51:00Z","metrics":{"control_message_seconds":0.096401,"control_ingest_seconds":0.057628,"candidate_a_message_seconds":0.100146,"candidate_a_ingest_seconds":0.057830,"candidate_b_message_seconds":0.098270,"candidate_b_ingest_seconds":0.059945},"guards":{"proof_verified":true,"minimum_target_gain_met":false,"source_restored":true},"verdict":"discard","reason":"the field comparisons and branches outweighed fewer Fp128 products; affected time regressed in both warm screens","artifacts":{"trace_a":"benchmark-runs/perfetto_traces/akita_stage6_zero_collapse_22a.json","trace_b":"benchmark-runs/perfetto_traces/akita_stage6_zero_collapse_22b.json"}}
{"index":3,"trial_id":"trial-003-pushforward-fusion","parent_id":"baseline-2e22","candidate_revision":"working-tree","proposal_summary":"compute base RA and increment G pushforwards in one split-eq cycle pass","started_at":"2026-07-31T01:52:00Z","finished_at":"2026-07-31T02:02:00Z","metrics":{"candidate_2e22_fused_g_seconds":0.146176,"candidate_2e26_fused_g_seconds":2.203683,"candidate_2e26_prove_seconds":54.453695,"candidate_2e26_maximum_rss_bytes":36237131776,"candidate_2e26_swaps":0,"control_2e26_base_g_range_seconds":[1.028477,1.132421]},"guards":{"proof_verified":true,"large_trace_crossover_observed":false,"source_restored":true},"verdict":"discard","reason":"the dense columns are much faster in their direct-scatter kernel; adding touched-set and delayed-reduction machinery nearly doubled pushforward time at 2^26","artifacts":{"trace_2e22":"benchmark-runs/perfetto_traces/akita_stage6_pushforward_fusion_22a.json","trace_2e26":"benchmark-runs/perfetto_traces/akita_stage6_pushforward_fusion_26.json"}}
{"index":4,"trial_id":"trial-004-blocked-round3","parent_id":"baseline-2e22","candidate_revision":"8f27504a5","proposal_summary":"materialize every shared RA polynomial over the same bounded source-index block before advancing","started_at":"2026-07-31T02:03:00Z","finished_at":"2026-07-31T02:20:15Z","metrics":{"control_2e26_bind_range_seconds":[0.503441,0.510236],"candidate_2e26_bind_seconds":[0.457865,0.440694],"candidate_2e28_bind_seconds":1.835546,"control_2e28_bind_seconds":2.348182,"candidate_2e28_stage6b_seconds":20.643826,"control_2e28_stage6b_seconds":21.580595,"candidate_2e28_prove_seconds":189.875866,"control_2e28_prove_seconds":193.699329,"candidate_2e28_maximum_rss_bytes":86738305024,"candidate_2e28_swaps":0},"guards":{"proof_verified":true,"minimum_primitive_gain_met":true,"trace_scaled_allocation_unchanged":true,"rss_limit_met":true,"zero_swaps":true,"full_validation_passed":true},"verdict":"keep","reason":"the exact target reduces Round-3 materialization by 21.83% and Stage 6b by 4.34% with unchanged analytical peak","artifacts":{"trace_2e26_a":"benchmark-runs/perfetto_traces/akita_stage6_round3_blocked_26.json","trace_2e26_b":"benchmark-runs/perfetto_traces/akita_stage6_round3_blocked_26b.json","trace_2e28":"benchmark-runs/perfetto_traces/akita_stage6_round3_blocked_28.json"}}
