{"candidate_revision": "df0b7c5cc", "elapsed_seconds": 0.4, "index": 1, "metric_value": 116.50216, "parent_id": "baseline", "reason": "Exhaustive D64 splits at bases 2-6 found no practical rank-6 schedule: basis 3 has no rank-6 SIS cell; the sole valid rank-6 plan is basis 6 with P=2^32 and a 24 TiB setup envelope, violating the RSS guard by orders of magnitude", "recorded_at": "2026-07-30T21:12:20.842984Z", "schema_version": 1, "trial_id": "trial-001-rank6-audit", "verdict": "discard"}
{"candidate_revision": "df0b7c5cc+d128-8cde1ae1", "elapsed_seconds": 2700.0, "index": 2, "metric_value": 81.48, "parent_id": "baseline", "reason": "Adjacent 2^28 control: commitment 121.99s to 81.48s (-33.2%), whole prover 225.90s to 193.97s (-14.1%); proof verified, RSS 81.65 to 81.45 GiB, zero swaps; analytical setup and commit NTT residency both decrease", "recorded_at": "2026-07-30T22:00:39.233530Z", "schema_version": 1, "trial_id": "trial-002-d128-k256", "verdict": "keep"}
{"candidate_revision": "d893d86ee+env-dense", "elapsed_seconds": 1100.0, "index": 3, "metric_value": 29.7, "parent_id": "trial-002-d128-k256", "reason": "Dense rotations reduce opening 36.06s to 29.70s and decompose_fold 10.67s to 4.09s, but adjacent max RSS increases by 263,438,336 bytes, matching the 243,269,632-byte table plus overhead; violates the no-memory-trade guard", "recorded_at": "2026-07-30T22:24:23.871470Z", "schema_version": 1, "trial_id": "trial-003-dense-rotations", "verdict": "discard"}
{"candidate_revision": "d893d86ee+compact-79b5ad69", "elapsed_seconds": 900.0, "index": 4, "metric_value": 33.15, "parent_id": "trial-002-d128-k256", "reason": "Adjacent 2^28 sparse control: decompose_fold 10.67s to 7.87s (-26.2%), opening 36.06s to 33.15s (-8.1%), max RSS 91,499,266,048 to 90,849,771,520 bytes, zero swaps; proof verified", "recorded_at": "2026-07-30T22:39:54.884505Z", "schema_version": 1, "trial_id": "trial-004-compact-rotations", "verdict": "keep"}
{"candidate_revision": "69b30cde4+basis3", "elapsed_seconds": 900.0, "index": 5, "metric_value": 118.22, "parent_id": "trial-004-compact-rotations", "reason": "D128 basis 3 lowered setup 12 to 10.75 GiB and opening 33.15s to 26.17s, but rank rose 3 to 4 and the exactly rank-linear root accumulation rose 86.87s to 118.22s; whole prover regressed 198.20s to 222.30s, proof verified", "recorded_at": "2026-07-30T23:01:33.878587Z", "schema_version": 1, "trial_id": "trial-005-d128-basis3", "verdict": "discard"}
{"candidate_revision": "69b30cde4+bulk-fill", "elapsed_seconds": 700.0, "index": 6, "metric_value": 10.87, "parent_id": "trial-004-compact-rotations", "reason": "At 2^25, direct tile fill reduced 2^25 tiny virtual calls and one redundant lane copy, but adjacent commit accumulation was 10.87s candidate versus 10.71s control (+1.5%); wide-ring shift accumulation dominates and the candidate did not clear the 3% screen", "recorded_at": "2026-07-30T23:16:43.969498Z", "schema_version": 1, "trial_id": "trial-006-bulk-row-fill", "verdict": "discard"}
{"candidate_revision": "69b30cde4", "elapsed_seconds": 255.0, "index": 7, "metric_value": 87.93, "parent_id": "trial-004-compact-rotations", "reason": "Final committed-state 2^28 repeat: prove 199.25s, commit 87.93s, evaluation proof 33.32s, max RSS 89,992,118,272 bytes (83.812 GiB, 335.25 gross B/cycle), zero process swaps, proof verified", "recorded_at": "2026-07-30T23:21:52.527065Z", "schema_version": 1, "trial_id": "trial-007-final-2e28", "verdict": "keep"}
{"candidate_revision": "69b30cde4", "elapsed_seconds": 180.0, "index": 8, "metric_value": 87.93, "parent_id": "trial-007-final-2e28", "reason": "Accepted source revalidated: 48 jolt-akita tests, committed Akita muldiv e2e, standard and zk muldiv suites, cargo fmt, host clippy, and host+zk clippy all passed; no source changes after the final 2^28 measurement", "recorded_at": "2026-07-30T23:33:55.189017Z", "schema_version": 1, "trial_id": "trial-008-final-gates", "verdict": "keep"}
